headline,short_description,authors,date
Horsemeat Scandal Raises Concerns Over Europe's Food Quality Control,"""We seem to be no clearer as to what the source of this contamination is, or whether the supply was ever destined for human","Reuters, Reuters",2013-02-10
Airlines Charging The Highest Fees: 24/7 Wall St.,(Click here to see the airlines charging the most and least in fees) Hobica explained this makes sense considering the history,"24/7 Wall St., 24/7 Wall St.",2013-02-10
The States People Are Fleeing In 2013: Forbes,"Moving company United Van Lines released its 36th annual study of customer migration patterns, analyzing a total of 125,000","Forbes, Forbes",2013-02-09
"No More Free Milk For 600,000 Poor Women And Children?","Some 600,000 poor women and children will no longer get free milk and cheese, and some 2,100 fewer food inspections will",,2013-02-09
5 Quick Fixes for Your Credit Score,"Your credit health is kind of like your physical health -- there's no fast lane to a perfect credit score or perfect health; it's a long-term journey. But just like you can make healthy diet and exercise choices today, you can do the same for your credit.","Bethy Hardeman, Contributor
Consumer Advocate, Credit Karma",2013-02-09
Governments Promise Punishment Over Horsemeat Scandal,The British unit of frozen foods group Findus began a recall this week of its beef lasagne from retailers on advice from,"Reuters, Reuters",2013-02-09
Report: Arkansas Law Imprisons Those Who Fail To Pay Rent,"Under a state law in Arkansas, renters can be imprisoned for failing to pay their rent. According to a report by Human Rights",,2013-02-09
Paul Krugman: GOP's Immigration Reform 'Problem Is Their Base Is Old White People',"Appearing Sunday on ABC's ""This Week,"" the Nobel Prize-winning economist and New York Times columnist first weighed in on",Harry Bradford,2013-02-03
Retailers Closing The Most Stores: 24/7 Wall St.,"It is the time of year again, when America’s largest retailers release those critical holiday season figures and disclose",,2013-02-03
Best-Paying College Majors Are Mostly In Engineering: Forbes List,"In short, while the unfortunate truth for graduates is that the jobs shortage is going to make finding a well-paying job",,2013-02-03
"Chipotle Salary Can Top $95,000 Annually","Chipotle is slightly different than most fast food chains since the company owns 100 percent of its restaurants, eschewing",Harry Bradford,2013-02-02
AR-15 Now The Most Wanted Gun In America,"THE phone rings again at Pasadena Pawn and Gun, and a familiar question comes down the line: ""Got any ARs?"" Read more on",,2013-02-02
Super Bowl Players Don't Know How Many Companies Are In The S&P 500 (VIDEO),"Luckily for players competing in the Super Bowl on Sunday, knowledge of the financial industry isn’t necessary to win the",,2013-02-02
Why We Lie At Work,"It's a common observation that the lies and the coverup, not the initial misbehavior, are what take public figures down. You",,2013-02-02
Vermont Governor Takes Heat for Warming Up To Wal-Mart,Does Gpv. Shumlin seriously think Vermonters are going to spend more money simply because they have another place to buy Chinese-made underwear? Cutting the retail pie thinner does not create net new jobs.,"Al Norman, Contributor
Founder, Sprawl-Busters",2013-01-27
"The Global Supply Chain: Our Economy, Security and Health Depends on It","The world's supply chain forms the backbone of our global economy, security and health, and the risks it faces are many. What to do?  We cannot plan for precisely how or when, but we can plan for the fact that disruptions will strike.","Stanley M. Bergman, Contributor
Stanley N. Bergman is the Chairman of the Board and Chief Exec...",2013-01-27
"According to Kids, Coke and the Critics Are Missing the Point","The industry doesn't get it. Not many kids crave Coke or sip it from that iconic bottle because it is 'sugar and fizzy water,' they love or loved Coke because of its marketing.","Rose Cameron, Contributor
CEO/Founder, WAT-AAH!",2013-01-27
A 'Rotten Twinkie' Is For Sale On eBay (PHOTO),"In fact, Twinkies do spoil and have a shelf life of about 25 days, the Washington Post reported. This may come as unwelcome",,2013-01-27
Are Doctors the Canary in the Coal Mine of Medicine?,"High patient volumes, the hassles of Electronic Medical Records (EMR), political uncertainty and changing reimbursement rates are all cited in surveys and online forums as new and increasing sources of stress for doctors.","Dike Drummond MD, Contributor
CEO & Founder TheHappyMD.com",2013-01-26
Going Down The Road -- In A Car That Drives Itself,Imagine your car taking you from your driveway at home to your office's parking lot without you having to touch the wheel. It would be commuter heaven.,"Don Tapscott, Contributor
Co-Author, with son Alex Tapscott, of Blockchain Revolution (M...",2013-01-26
America's Most Misleading Product Claims: 24/7 Wall St.,One of the public interest groups that has been at the forefront of suits related to food or drink and health is consumer,"24/7 Wall St., 24/7 Wall St.",2013-01-26
"Inaugural Corporate Donors Include Bank Of America, Coca-Cola, Microsoft",Organizations with lobbying arms that are backing the inauguration -- which include labor unions in addition to major corporations,Jillian Berman,2013-01-20
It's About to Get Surreal,"The gift of Surrealism is its power to suggest alternate realities, realities that defy explanation, that are intensely personal and communal at the same time, realities that are as porous and fluid as our reality actually is.","Schuyler Brown, Contributor
Founder and Strategy Director @ Sightful (www.sightful.io), fa...",2013-01-20
Warren Buffett: Congress Is The Biggest Problem Facing Obama In His Second Term (VIDEO),"“What is right about America just totally dwarfs what’s wrong with Washington,” Buffett told CBS News in a recent interview",,2013-01-20
Obamacare 2013: Obama's Legacy Tied To Health Care Reform That Bears His Name,"While Republican governors like Rick Perry of Texas and Bobby Jindal of Louisiana may be immovable, Obama needs to keep the",Jeffrey Young,2013-01-19
"If You Want Older People to Work Longer, You Have to Give Them Jobs","We need people in ""human resources"" to realize that you're still ""human"" when you're over 50, and to be trained in how to recruit and train employees who are older than them.","Christina Patterson, Contributor
Writer, columnist, broadcaster, communications consultant",2013-01-19
Timothy Geithner Accused Of Alerting Banks To 2007 Interest Rate Cut For 2nd Time,"Geithner said banks ""obviously don't have any idea that we're contemplating a change in policy"" - a statement that Lacker","Reuters, Reuters",2013-01-19
The Worst Run Cities In America: 24/7 Wall St.,"These are the Best and Worst Run Cities in America, according to 24/7 Wall St.: Regardless of whether this happens, more","24/7 Wall St., 24/7 Wall St.",2013-01-19
8 Scandals That Make Lance Armstrong's Doping Look Like No Big Deal,"Lance Armstrong, he of illegal performance-enchancing drug confessions, has been called a lot of things recently, among them",Harry Bradford,2013-01-19
Jamie Dimon's Bonus Could Be Hurt By London Whale Loss,JPMorgan’s board will weigh releasing an internal report this week that pins some of the fault for the bank’s “London Whale,Jillian Berman,2013-01-13
Paul Krugman: GOP Debt Ceiling Strategy Is 'Hostage Taking',Paul Krugman on Sunday accused the Republican leadership of holding the country hostage. “The debt ceiling is a fundamentally,Jillian Berman,2013-01-13
The Downside To Low Unemployment,"CASPER, Wyo. — After losing everything last year to Southern California’s soured economy, Tiffany Kipp and her family packed",,2013-01-13
The 15 Greatest Job Titles In The History Of Mankind (PHOTOS),"Find the rest of the collection at World Wide Interweb. See, there are a lot of great jobs out there. You simply have to","World Wide Interweb, World Wide Interweb",2013-01-12
"James Yeager, CEO Who Threatened To 'Start Killing People' Over Gun Control, Backpedals... Sort Of",WSMV Channel 4 INTERVIEWER: The attention-getter is saying that you're going to shoot some people. YEAGER: Right. INTERVIEWER,,2013-01-12
10 Cars So Hot They're Out Of Stock: 24/7 Wall St.,An analysis of cars that sit on dealer lots for the least time finds that they fall into three groups. The first consists,"24/7 Wall St., 24/7 Wall St.",2013-01-06
"Fiscal Cliff Deal May Cause Wealthy To Curb Spending, Defer Income, Financial Advisers Say","By Jennifer Hoyt Cummings and Jessica Toonkel While these people may be very well-off by any standard, it does not mean that","Reuters, Reuters",2013-01-06
"New Year, Same Old Banks","For my New Year's resolution, I want to understand the banks.  I have a scientific curiosity about how these banks work.  The only way I can think of to truly understand the banks is to dissect one of them.","Dr. Brian Penny, Contributor
Whistleblower and Troll",2013-01-06
The 5 Least Stressful Jobs Of 2013: CareerCast,"""They don't necessarily pay particularly well,"" Lee said. ""Salaries on average are higher for the most stressful jobs than","CNBC, CNBC",2013-01-05
The States That Recovered Most (And Least) From The Recession: 24/7 Wall St.,December marked the five-year anniversary of the official beginning of the Great Recession — the most severe economic contraction,,2013-01-05
"Fiscal Cliff Deal Dodges Economic Bullet, For Now","That is in line with what many financial firms on Wall Street and around the world have been expecting, suggesting forecasts","Reuters, Reuters",2013-01-01
"The Biggest Billionaire Scandals Of 2012, According To Forbes","Fitzgerald, consummate chronicler of the haves and have mores, was onto something. Covering the billionaire beat for Forbes","Forbes, Forbes",2012-12-30
The Real Victims Of Slow Holiday Sales: Retail Workers,"Several large retailers took a leap of faith on what they thought would be a gangbuster holiday season, hiring more seasonal",,2012-12-30
The 2012 Predictions That Never Came True: CNBC,Check out some 2012 predictions that never came true below and click over to CNBC for more: While the bulls have made hugely,"CNBC, CNBC",2012-12-29
It's Time for Cramer to Short His Show,"Obviously, Jim Cramer is not always wrong.  He has picked many winners, but overall his record is no better than one you would expect from random chance.","Dan Solin, Contributor
Author of the Smartest series of books",2012-12-25
Paul Krugman: Deficit Hawks Are 'Remarkably Foolish',"“The persistence of the inflationista, eek! deficits! view despite year after year of failure -- and the amazing effort put",,2012-12-25
Reflections for Improving Work Relationships in the New Year,Success is not achieved within a vacuum. We must be able to build healthy relationships with others to achieve any success in business and life. Commit to increasing your ability to build these relationships in the upcoming year!,"Dr. Patty Ann Tublin, Contributor
Emotional Intelligence, Communication & Relationship Expert",2012-12-24
What Stores Are Open On Christmas?,"The short answer is, not many stores are open on Christmas. Most large retailers -- including Walmart, Target and Kmart -- will",Caroline Fairchild,2012-12-24
The States Doling Out the Best (And Worst) Benefits,"With the president and Congress attempting to reach a budget deal in an effort to avoid the fiscal cliff, it is likely they",,2012-12-24
A Christmas Carol for Bankers,"With the help of three ghosts, Scrooge finally reached redemption by learning to give to others.  As events of the past two weeks have shown, modern bankers have their own ghosts to face: federal prosecutors.","Brandon L. Garrett, Contributor
Professor of Law, University of Virginia",2012-12-24
Paul Krugman: Fiscal Crisis Prophets Are Members Of 'A Doomsday Cult',Back in the 1950s three social psychologists joined a cult that was predicting the imminent end of the world. Their purpose,,2012-12-24
Do You Want to Be Happy at Work? Try Being Funny,"Humor in the office is highly under-rated, but there is a very fine -- let me emphasize very fine -- line between when to make a joke and when not to.","Denice Kronau, Contributor
Author, speaker, former Chief Diversity Officer, Siemens AG",2012-12-23
"FBI Investigated 'Occupy' As Possible 'Terrorism' Threat, Internal Documents Show","""This production ... is a window into the nationwide scope of the FBI’s surveillance, monitoring, and reporting on peaceful",Alice Hines,2012-12-23
Gun Shows Packed As Enthusiasts Rush To Buy Assault Weapons,"The Second Amendment to the U.S. Constitution guarantees the right to bear arms, and most gun enthusiasts at the shows on","Reuters, Reuters",2012-12-22
11 Super Bizarre '90s Toy Fads (PHOTOS),"This year, new toys are so lame that we're turning to the '90s for gift-giving ideas, at least according to a report from",Caroline Fairchild,2012-12-22
11 Worst Predictions Of The Year,The Mayans weren't the only ones who got it wrong this year. Here are a few of the worst predictions of 2012. Read more on,,2012-12-22
"National Shooting Sports Foundation, Second Most Powerful Gun Lobby, Headquartered In Newtown, Connecticut","Just across the highway from Sandy Hook Elementary School in Newtown, Connecticut, in a stately white building with an American",,2012-12-15
America's Disappearing Restaurant Chains: 24/7 Wall St.,"In the past 10 years, some of America’s biggest food chains have lost more than 50% of their sales as they closed hundreds",,2012-12-15
Need A Job? Glassdoor Presents The Best Places To Work In 2013,"It's difficult to put a finger on what exactly makes employees happy, but career community website Glassdoor just released",Alexis Kleinman,2012-12-15
A DJ's Guide To Partying With Co-Workers,"DJs at corporate functions have the best seat in the house to observe employee interactions, which can range from stupid",,2012-12-09
Paul Krugman: Ryan Budget 'A Fake Document',"""The Ryan budget is full of -- is full of magic asterisks, too. It's not a real budget. It's a fake document. I mean, I'm",Alana Horowitz Satlin,2012-12-09
Jack Welch Casts Doubt On Jobs Report Again,"Welch, the former longtime General Electric CEO, became notorious for implying on Twitter in October that Obama's presidential",Bonnie Kavoussi,2012-12-08
"Macy's CEO Terry Lundgren Betrays 'Christmas Spirit,' Says Progressive Group","Lundgren is one of 71 CEOs of public companies in the Fix The Debt coalition, which is lobbying to narrow the deficit by",Alice Hines,2012-12-08
The Most Ridiculous Things To Come Out Of CEOs' Mouths In 2012,CEOs really put their feet (and anything else they could find) in their mouths this year. With the presidential election,Alexis Kleinman,2012-12-08
Fiscal Cliff Takeaways From the Sunday News Shows,"Television networks devoted much of their Sunday news shows to the fiscal cliff, reflecting the urgency and importance of the topic. So did you end up wasting precious weekend hours watching shows that just covered familiar old ground? No.","Mohamed A. El-Erian, Contributor
Chief Economic Advisor, Allianz",2012-12-02
"As Companies Seek Tax Deals, Governments Pay High Price","In the end, the money that towns across America gave General Motors did not matter. Read more on The New York Times",,2012-12-02
10 Things The Fast Food Industry Doesn't Want You To Know,Think your Big Mac was flipped by a teenager just looking for some pocket change? That's less and less the case these days,Jillian Berman,2012-12-01
The World's Most Emotional Countries: 24/7 Wall St.,"Forget all the stereotypes about the reserved English or the hotblooded Italian. When it comes to being least emotional, Singapore",,2012-12-01
Entrepreneurism: Lots of Little Traumas and No Big Ones,"I loved my years in corporate America, which I now view as preparation for real life in the entrepreneurial moshpit. I'll take comforting laid-off clients and drumming up new clients any day over waking up with jaw aching from anxious grinding all night worrying about corporate politics.","Liz Ryan, Contributor
Speaker, writer, soprano and mom; founder, Human Workplace",2012-11-25
LIPA Customers Left Without Power For Weeks Sent Normal Electric Bills Despite Blackouts,"According to Bloomberg, two customers accuse LIPA of failing to provide electric services because of its “disregard” in management",,2012-11-25
"Sex, Violence, David Petraues and PSC in Afghanistan","For those who work on private military and security contracting issues one longstanding, and still vexing, issue is encapsulated in just three words: ""inherently governmental functions""","David Isenberg, Contributor
Author, 'Shadow Force: Private Security Contractors in Iraq'",2012-11-25
How Corporate America Is Turning Into a Cult and Why It's Harming the American Employee,"Over the last decade or so, a growing disconnect has developed between the bizarre and almost cult-like rhetoric and practices that companies use with their staff, and the increasingly grim reality of being an employee in modern day Corporate America.","Ruth Whippman, Contributor
Author of The Pursuit of Happiness",2012-11-24
My Thanksgiving: A Turkey Sandwich at Walmart,"I did not spend Thanksgiving evening with my wife and my five children. I spent it, instead, handing out turkey sandwiches to workers in Walmart. And showing my support for one brave soul who walked off the job in protest against exploitation.","Fmr. Rep. Alan Grayson, Contributor
Former U.S. Congressman for Orlando, Florida",2012-11-24
"Walmart Strike Hits 100 Cities, But Fails To Distract Black Friday Shoppers","Click here or scroll down for photos from Walmart strikes across the country. ""Walmart cuts hours and benefits to push people",Alice Hines and Kathleen Miles,2012-11-23
Walmart Strikers Prepare For Black Friday Protests Across Country,"One worker in the Chicago area, who asked that her name not be mentioned for fear of losing her job, told The Huffington",Alice Hines,2012-11-23
Grand Old Planet,"Earlier this week, GQ magazine published an interview with Senator Marco Rubio, whom many consider a contender for the 2016",,2012-11-23
Restaurants Open On Thanksgiving: A Guide To Where You Can Eat,Maggiano's is open on Thursday and you can make reservations online at a restaurant near you. The cost is $36.95 per person,,2012-11-22
"Planes, Trains and Cars: Cartels Take Over the Travel Industry","If airlines and car rental companies want to increase market share, the big guys should have to earn it by winning the business and loyalty of their customers; not by gobbling up competitors or driving them out of business","Hillary Adler, Contributor
Poet, writer, travel blogger, politics junkie",2012-11-22
Least Valuable CEOs Revealed: 24/7 Wall St.,Also Read: America’s Most Valuable CEOs At the one end of the compensation to market cap ratio are relatively small companies,"24/7 Wall St., 24/7 Wall St.",2012-11-18
Bimbo & Twinkies: Mexican Mega Bakery May Save Brands From Hostess Liquidation,"But the strange, snack-cake related behavior doesn't stop there. A bizarre petition urging President Barack Obama to ""nationalize",,2012-11-18
"GM Opens Baojun Plant, Taking Aim At China's No-Frills Customers","GM so far has two products for Baojun: the 630 compact sedan, which has a starting price of 62,800 yuan, and a mini car called","Reuters, Reuters",2012-11-18
African Pension Funds: The missing Link to African Development?,"Looking at the world demographic trends, it is clear that the future of the world might just be played in Africa: Africa is the ""youth"" of the world. This is a reservoir of youth, reservoir with big investment needs.","Mahamadou Lamine Sagna and Ibrahim Sagna, Contributors",2012-11-17
Timothy Geithner: U.S. 'Absolutely' Should Get Rid Of Debt Ceiling,Congress and the Obama administration reached an agreement to raise the debt ceiling at the last minute last year. By threatening,Bonnie Kavoussi,2012-11-17
The Business World's Most Troublesome Affairs,"After former Gen. David Petraeus resigned as director of the CIA in the wake of an extramarital affair, he said in a statement",,2012-11-17
Federal Reserve Chairman Ben Bernanke's Interest Rate Policy Poses Challenges For Successor,* U.S. central bank adopting series of policy guidelines * Next on agenda: economic thresholds to guide rate hikes * Bernanke,"Reuters, Reuters",2012-11-11
America's Most Expensive Neighborhoods: 24/7 Wall St.,"A little-known Northern California town, established more than 100 years ago on a tract of land owned by a Scottish liquor",,2012-11-11
Goldman Sachs In Settlement Talks Over $8.3 Billion Trading Loss,Nov 10 (Reuters) - Goldman Sachs Group Inc is in settlement talks with the U.S. government over an $8.3 billion position,"Reuters, Reuters",2012-11-10
'Chained CPI' May Be Key In Avoiding Fiscal Cliff,"In an interview on NPR, Robert Greenstein, from the Center for Budget and Policy Priorities, explained it this way: ""If, for",Joe Van Brussel,2012-11-10
Abacus and Other Soured Deals as Now Seen by the New York Times,The Business editors of the New York Times seem forever determined to whitewash and sanitize one of the core causes of the 2008 financial debacle and those who were central to the melt down.,"Raymond J. Learsy, Contributor
Author",2012-11-04
October Jobs Report Unlikely to Help Either Candidate,"In some ways, the tragic events in the Northeast from Hurricane Sandy and discussions around the upcoming fiscal cliff are likely to overshadow this lackluster jobs report as it generally just showed things are improving, albeit slowly.","Katie Bardaro, Contributor
Lead economist, PayScale.com",2012-11-03
Unequal Realities Inside The Jobs Report,Today's U.S. Labor Department report on jobs confirms what we've known for more than a year: We have entered a new normal,,2012-11-03
Meet The Most Indebted Man In The World,He can earn million-dollar gains without anybody knowing. He can execute make-believe trades by sending fake emails from,,2012-11-03
Hurricane Sandy and the Failure of GDP,"Analysts are predicting that the positives and negatives will largely cancel each other out and there will be little impact on GDP -- looking deeper, though, it becomes clear that this isn't true.","J. Mijin Cha, Contributor
Assistant Professor, Urban and Environmental Policy Department...",2012-11-03
Fiscal Cliff Economic Impact 'Could Be Worse' Than Expected,These researchers suspect fiscal contractions take a bigger-than-normal bite from economies when interest rates are very,"Reuters, Reuters",2012-10-28
The States With The Most 'One Percenters',"One of the enduring legacies of the Occupy Wall Street movement is the term “One Percent,” referring to the percentage of",,2012-10-27
Why Someone Needs To Take A Knife To Citigroup,THE defenestration of Vikram S. Pandit from the corner office at Citigroup might just be a turning point for shareholders,,2012-10-21
Wealthy Presidential Campaign Donors Driving The Election,"* Whiteco Industries - Indiana-based company involved in advertising, construction, entertainment and hotels. Donation: $1","Reuters, Reuters",2012-10-21
Zombie Apocalypse Product Guide: CNBC,"In this way, the zombie apocalypse has already come. An invasion of walking dead has gripped the public imagination and is",,2012-10-20
Billionaire Who Thinks Obama Is A Socialist,It hardly counts as news anymore when some put-upon billionaire starts fulminating about Barack Obama. The likes of the Koch,,2012-10-20
Jobs That Make Workers Feel Really Guilty: Payscale,Everyone has to pay the bills somehow. Some people just don't feel great about the means to that end. That's not to say all,Harry Bradford,2012-10-20
"Koch Brothers Send Pro-Romney Mailing To 50,000 Employees, Allegedly 'Stifle Political Speech'","In a statement sent to Up w/ Chris, Rob Tappan, Koch Companies director of external relations, said that the letter was sent",,2012-10-14
Diamond Jamie: Latest News on the JPMorgan Chase Crime Watch,"A new lawsuit against JPMorgan Chase is being met with both optimism and skepticism. But, ironically, investigators have finally broken their silence on criminal indictments for bankers... to protect its chief executive.","Richard (RJ) Eskow, Contributor
Host of 'The Zero Hour'; Writer; Senior Advisor, Social Securi...",2012-10-13
The 13 Best Paid College Majors: 24/7 Wall St.,"According to a new study conducted by the U.S. Census Bureau, the average college graduate will earn $2.4 million over his",,2012-10-13
"Contaminated Food Causes More Than 3,000 Death Each Year","Audit Guidelines The inspector, a 26-year-old with little experience, raised no objections to the absence of an antimicrobial","Bloomberg View, Bloomberg View",2012-10-13
"Honda CR-V Recall: Automaker Recalls 489,000 Over Concerns Vehicle Could Catch Fire","TOKYO, Oct 7 (Reuters) - Honda Motor Co said it would recall about 489,000 CR-Vs in Europe and the United States after finding","Reuters, Reuters",2012-10-07
The States With The Cheapest Gas: 24/7 Wall St.,"Since June, gasoline prices have climbed more or less steadily and are now 35 cents per gallon higher than they were a year",,2012-10-07
Seven Types Of People That Should Never Receive Jobless Benefits,"Unemployment benefits are intended to provide some help for Americans who need it most. Sometimes, that money can end up",,2012-10-07
"Mark Pincus, Zynga CEO, Lost $4 Million Per Day",Mark Pincus is the latest social-media CEO to become a billionaire - and then a former billionaire - in just six months. Read,,2012-10-06
Warren Buffett's Berkshire Hathaway's Biggest Investments: CNBC,"Below are some of the biggest holdings of Berkshire Hathaway, click over to CNBC for the full list: Spain Finance Minister’s",,2012-10-06
