headline,short_description,authors,date
Chairman Ben Bernanke and Vice Chair Janet Yellen Have Supported an Economic Time Bomb,"It is long past time for Vice Chair Janet Yellen, the nominee for Federal Reserve chair, and Chairman Ben Bernanke to describe the Federal Reserve stimulus hoax and the time bomb the Fed created.","Robert Auerbach, Contributor
Professor of Public Affairs, The University of Texas at Austin",2013-11-23
Taking a Stand for Paternity Leave Equity,"It is reasonable that new mothers get a somewhat more generous parental leave policy than new dads. However, it is difficult to make a fair, rational case for a 500 percent difference in the length of maternity and paternity leaves.","Scott Behson, PhD, Contributor
Professor of Management, Fairleigh Dickinson University. Autho...",2013-11-17
Palin's National Debt Mischaracterization vs. American Indebtedness,"There's no way to attain the American dream anymore for young and old alike unless the overall debt problem in America, not just the national debt, is brought under control.  In economic terms, this debt is truly enslaving our children.","Steven Kurlander, Contributor
Attorney and Blogger",2013-11-17
Timothy Geithner To Join Private Equity Firm Warburg Pincus: WSJ,"Nov 16 (Reuters) - Former U.S. Treasury Secretary Timothy Geithner is joining private-equity firm Warburg Pincus, the Wall","Reuters, Reuters",2013-11-16
When Ads Tell Compelling Stories...,What compelling story can you create for your business? 3. Reunion When an Ad tells a compelling story and touches the hearts,"Rajesh Setty, Contributor
Serial entrepreneur",2013-11-16
Butterball's Turkey Shortage Might Ruin Your Thanksgiving,"The company told retailers that their orders for fresh turkeys 16 pounds (7.3 kg) and bigger have been cut by 50%, according","Quartz, Quartz",2013-11-16
Prepaid Debit Cards: Are They Right for You?,"Just because Russell Simmons, Magic Johnson, Justin Bieber and a host of other celebrities are endorsing prepaid debit cards, it doesn't mean they are right -- or wrong -- for you. Here's how to work through the decision.","Eric Adamowsky, Contributor
Co-founder, Credit Card Insider",2013-11-16
US Airways Kicks Blind Man Off Plane and Employs the 'Ostrich Strategy' to Public's Outrage,"I hope I'm asking this question on behalf of the majority of my peers, but which school of thought produced the Ostrich strategy in regards to responding to customer service, and ultimately, public relations issues?","Reid Wegley, Contributor
PR Guy & Coolhunter",2013-11-16
Cities With The Widest Wealth Gaps: 24/7 Wall St.,It might be expected that a metropolitan area with high income would have very large populations of both extremely wealthy,"24/7 Wall St., 24/7 Wall St.",2013-11-10
Changing Thymes: How To Know Exactly When To Evolve Your Organization,"The new CFO, Allison Garside, is amazing. She brought the essence of what we talked about earlier - finance vs. accounting","George Bradt, Contributor
Executive Onboarding Expert, PrimeGenesis",2013-11-10
Jobs Where Women Are Getting Paid The Least Compared To Men,"The gender wage gap has narrowed over the years. In 1979, women made an estimated 62% of what men earned. In 2012, the wage",,2013-11-09
You're More Likely To Be Struck By Lightning Than Create A $1 Billion Startup,"Many entrepreneurs, and the venture investors who back them, seek to build billion-dollar companies. Why do investors seem",,2013-11-03
Focus Is the Gateway to Business Success,"Focus doesn't get the respect it deserves in the business world. We hear a lot about motivation, stress, emotions, leadership, and team culture, but not much attention is paid to the role that focus plays in your ability to be productive. Well, I'm here to change all that.","Dr. Jim Taylor, Contributor
Sport psychologist, parenting expert, professor, author, speak...",2013-11-03
How My Iranian-Israeli Grandfather Helped Me Find My Career Path,"When I was asked, at five years old, I said an astronaut and a teacher. I imagine that no matter what I would have said at that age my parents would have smiled and told me I could do anything I set my mind to doing.","Leah Yomtovian Roush, Contributor
Executive Project Analyst for the CEO at TOA Technologies",2013-11-03
Goldman Finally Tries to Get People to Work Less,"Now they tell us. After years of hearing that it was impossible to restructure jobs to make them more doable, guess what? According to The Wall Street Journal, when Goldman Sachs discovered it couldn't attract and retain the most promising recruits with pay and perks alone.","Jody Greenstone Miller, Contributor
Jody Greenstone Miller, Co-Founder and CEO of Business Talent ...",2013-11-03
The States With The Most And Least Affordable Colleges,"Average in-state tuition at public four-year universities rose by just 2.9% this year, the smallest increase in more than",,2013-11-02
7 Myths About Ethics Which Will Hurt Your Business,"It's easy to be ethical. This myth ignores the complexity surrounding ethical decision making, particularly within business","Martin Zwilling, Contributor
I provide pragmatic advice and services to entrepreneurs and s...",2013-10-27
Fast-Food Chains Costing Taxpayers The Most Money: 24/7 Wall St.,24/7 Wall St.: The fast-food industry is one of the nation’s largest employers of low and minimum wage workers. According,"24/7 Wall St., 24/7 Wall St.",2013-10-27
Larry Ellison Is a Conservation Leader,"And as Larry Ellison knows when you make your own energy to run football fields of servers storing most of the business data, globally and there's extra energy left over -- then it's sold back into the grid, maximizing the investment.","Dr Reese Halter, Contributor
Broadcaster, Biologist",2013-10-27
The One Thing the Best Leaders and Most Liked People Have In Common,"Since humans love to talk, if you can focus on listening, truly listening attentively to the person you're with, that person will adore you.","Dave Kerpen, Contributor
CEO, Likeable Local",2013-10-26
11 Countries That Still Have Perfect Credit: 24/7 Wall St.,"U.S. government gross debt amounted to 102% of GDP in 2012, 11th highest in the world. On Some of the top-rated countries","24/7 Wall St., 24/7 Wall St.",2013-10-20
How To Succeed In Business As A Woman,"When I started the Corner Office column more than four years and about 250 interviews ago, I set several guidelines for the",,2013-10-20
The Most Educated Countries In The World: 24/7 Wall St.,"Between 2010 and 2011, the percentage of adults with a college degree in the United States remained unchanged at 42%. Since",,2013-10-19
"James Street, All-American Businessman",The stories usually stopped when James was 22 years old. They missed the great story of what James accomplished after sports ended and business life began. He built one of the most successful structured settlement and settlement planning firms in the United States.,"Don McNay, Contributor
Best selling lottery and structured settlement expert",2013-10-13
Obamacare Website Problems Are Worse Than Many People Realize,"WASHINGTON — In March, Henry Chao, the chief digital architect for the Obama administration’s new online insurance marketplace",,2013-10-13
"Shapeways Delivers 3D Printing as a Service, Reshaping Business Processes","Trying to configure, calibrate, and properly print a 3D object is a clunky experience. Fortunately, there are services that enable this: Meet Shapeways, a 3D factory available now for you.","Jeremiah Owyang, Contributor
Founder, Crowd Companies",2013-10-12
Government Shutdown Halts Logging Industry Production,"""We're scrambling like everyone else to keep our heads above water,"" Kuehn said. Scott Kuehn, procurement forester for Tricon","Reuters, Reuters",2013-10-12
10 American Companies Cutting The Most Jobs: 24/7 Wall St.,"These are the 10 companies cutting the most jobs, according to 24/7 Wall St. In an interview with 24/7 Wall St., Challenger","24/7 Wall St., 24/7 Wall St.",2013-10-12
Rap Lyrics Make The Case For Investing In Twitter,"Twitter is, by most conventional metrics, considerably less popular than Facebook and arguably growing more slowly to boot",,2013-10-06
Change Warriors: They Master Four Solutions,"Many management gurus, academics, and CEOs are writing on change, yet there is a difference between the theoretical and academic, and actual change.","Judith E. Glaser, Contributor
CEO, Benchmark Communications, Inc.; chairman, The Creating WE...",2013-10-05
Latest Figures Reveal Uptick in Refinancing Activity,"Rising mortgage rates may have thrown some cold water on refinancing activity, but they have not frozen it completely. Two statistics released this week show signs of hope for refinancing.","Richard Barrington, Contributor
CFA, MoneyRates.com",2013-10-05
Leadership Burnout: A Simple Way to Re-engage,"Is there a simple way to begin to support leadership development and cultivate the ability to lead with excellence? Happily, there is.","Janice L. Marturano, Contributor
Founder and Executive Director, Institute for Mindful Leadership",2013-09-29
This May Be The Coolest Way Ever To Quit Your Job,"In a Skype chat with The Huffington Post, Shifrin wrote that the Taiwanese work environment is very different from the American",Caroline Fairchild,2013-09-29
10 States With The Worst Health Coverage: 24/7 Wall St.,"Last year, just under 15% of the U.S. population did not have health insurance coverage. But as the different stages of the",,2013-09-28
The 10 Richest States In America: 24/7 Wall St.,"Here are America's richest states, according to 24/7 Wall St. The types of jobs available in each state also affect income","24/7 Wall St., 24/7 Wall St.",2013-09-22
Marketing in China: Twenty Years On,"I have lived in China since 1994 and in Shanghai since 1998.  When people hear this, the most common reaction is, ""You must have seen huge changes."" I respond, ""Perhaps not quite as much as you might expect.""","Tom Doctoroff, Contributor
Brand advocate, corporate leader, Chinese consumer expert",2013-09-22
My Girlfriend Committed Suicide Owing Sallie Mae. I Co-Signed.,"Can Sallie Mae deny you online access? Sure, they are not under any obligation I am aware of to provide online access if","Steve Rhode, Contributor
Consumer Debt Expert & Firefighter",2013-09-21
America's Poorest States: 24/7 Wall St.,"Last year, household income remained effectively unchanged, according to data released this week by the U.S. Census Bureau",,2013-09-21
"Summers Withdraws, U.S. Stock Futures Advance",Sept 15 (Reuters) - U.S. stock futures advanced and futures for the U.S. Treasury 10-year note gained late Sunday after Lawrence,"Reuters, Reuters",2013-09-15
"On 5th Anniversary Of Lehman Collapse, Americans Still Angry","'NOTHING'S REALLY CHANGED' ""On the other hand, we have the 99 percent who see it from a very different angle, and in particular","Reuters, Reuters",2013-09-15
About A 50/50 Chance A Computer Will Be Doing Your Job In 20 Years,"Thought your job was safe? Not so much, say researchers at University of Oxford's James Martin school. There, a group of",,2013-09-14
About A 50/50 Chance A Computer Threatens To Steal Your Job: Paper,"That’s worrying news for U.S. workers, many of whom are already hurting for a pay hike. The bottom 70 percent of the income",Maxwell Strachan,2013-09-14
The Real Reason Women Are Leaving Wall Street: Quartz,"”The sacrifices are enormous,” adds Horowitz. “You have to work hard, the politics are hard, it is hard to be in a minority","Quartz, Quartz",2013-09-08
"The IRS Spent $10,000 On This Awful Parody Of 'The Apprentice' (VIDEO)","Rep. Charles Boustany, the chair of the House Ways and Means subcommittee which oversees the IRS, released a statement to",Ryan Grenoble,2013-09-08
The States Where The Most People Go Hungry: 24/7 Wall St.,"Indeed, according to a 2012 Gallup-Healthways survey, people in nine of the 10 states were less likely to eat healthily on","24/7 Wall St., 24/7 Wall St.",2013-09-08
11 Countries With Soaring Inflation: 24/7 Wall St.,"While inflation has been relatively tame in the United States and Europe, several large nations have struggled with rising",,2013-09-07
5 Jobs Of The Past: Vintage Photos,"As technology improves and the needs of society change, new jobs are created while old ones move toward extinction. Over",,2013-09-02
Nearly All Employed Americans Do Work-Related Tasks During Their Personal Time,"More From CNBC: -- Legal pot creates jobs, big biz interested: Expert -- Tooth fairy’s generosity skyrockets to $50 -- After","CNBC, CNBC",2013-09-02
"Verizon, Vodafone Agree On $130 Billion Deal",It will have a U.S. tax liability of around $5 billion. The deal will give Verizon full access to the wireless unit's cash,"Reuters, Reuters",2013-09-02
Labor Day Sales 2013: Where To Find The Best Store Deals And Discounts,"Alas, Labor Day has arrived. Say goodbye to those white pants and say hello to big discounts from your favorite retailers",Catherine Taibi,2013-09-01
90 Percent Of Employers Tie Workers' Pay To Company Performance,Caterpillar will not break any profit records in 2013. Cancellations from mining customers have weighed on sales and profits,"Reuters, Reuters",2013-09-01
"Meet The Billionaire Who Controls Your Ketchup, Beer","After they sold H.J. Heinz to Warren Buffett and a bunch of Brazilians in June, the ketchup manufacturer's outgoing board",,2013-09-01
"This Labor Day, Much Of America Will Be . . . Laboring","Will you be barbecuing this Labor Day, or slaving away at the office? Read more on time.com",,2013-08-31
Occupy Wall Street Protesters Largely Defeated By Slow Pace Of Justice,"The grind that confronts criminal defendants was a revelation for Occupy defendants, many of whom were white, first-time","Reuters, Reuters",2013-08-31
Fast-Food Strikes Lend Much-Needed Fire to Largely Dormant Labor Movement,"Employees walked out of about 1,000 restaurant. Many earn the $7.25-an-hour federal minimum wage. They're demanding $15 an hour instead, contending, as one Los Angeles striker told The Times' Steven Greenhouse, that ""people can't survive on the minimum wage.""","Jerry Lanson, Contributor
Emerson College journalism professor",2013-08-31
NSA Employees Spied On Romantic Interests In The Past: Report,"“NSA has zero tolerance for willful violations of the agency’s authorities,” the NSA said in a statement on the news, according",,2013-08-25
Community Banks Are Failing; Pawnshops Are Growing,"Five years after the failure of Lehman Brothers, the mega banks have rebounded, community banks that serve vulnerable niches of American consumers, and which played no role in causing the Financial Crisis, are failing, and non-traditional lenders are expanding.","Tanya D. Marsh, Contributor
Professor of Law, Wake Forest University",2013-08-25
The Lesson From Inflation,"Such low inflation means producers can't charge more for their products, therefore can't increase profits unless they use","Harlan Green, Contributor
Editor/Publisher",2013-08-25
Total Helicopter Crash: 4 Oil Contractors Dead In Tragedy Off Scottish Coast,"The mother of one of the survivors told Sky News, ""He said it seemed to lose power and there was no time to brace. They just","Reuters, Reuters",2013-08-24
Bloomberg's Advice For Success: Take As Few Bathroom Breaks As Possible,New York Mayor Michael Bloomberg said on his weekly radio show Friday morning that one of the keys to his success was essentially,Braden Goyette,2013-08-24
Hiring In China By JPMorgan Under Scrutiny,Federal authorities have opened a bribery investigation into whether JPMorgan Chase hired the children of powerful Chinese,,2013-08-18
"These Wendy's Training Videos From The '80s Are Trippy, Brilliant","This Wendy's ""Grill Skills"" training video from the 1980s doesn't require much of an introduction. We suggest you watch it",,2013-08-18
The Student Loan Lawyers Say I Have to Settle,"Huffington Post Reader Question If you'd like to stay posted on all the latest get out of debt news and scam alerts, subscribe","Steve Rhode, Contributor
Consumer Debt Expert & Firefighter",2013-08-11
States Where It It Hardest To Find Full-Time Work: 24/7 Wall St.,"As the nation continues to recover from the recession, not only is the unemployment rate down, but the underemployment rate",,2013-08-11
Will the Latest Powerball Winner Turn Into a Lottery Loser?,The latest lottery winner overcame a 171 million-to-one shot to win the Powerball. He is going to need the same kind of luck to hang on to the money and keep it from destroying his life.,"Don McNay, Contributor
Best selling lottery and structured settlement expert",2013-08-11
QE3Important For Housing Recovery,So what is wrong with at least some of the Fed Governors that they see growth where there isn't any? How in fact can they,"Harlan Green, Contributor
Editor/Publisher",2013-08-10
"The Problem In The U.S. Is Economic Mobility, Not The Minimum Wage: Quartz",But this does not change the fact that it is harder lately for low-skill workers to move up through the economic ranks. Ideally,"Quartz, Quartz",2013-08-04
"Watch Semi-truck Go Airborne, Explode",Head to CNN for the crazy video. Read more on cnn.com,,2013-08-04
"Fair Labor Association, Watchdog To Big Retailers, Sows Its Own Worker Discontent In Budget Crunch","In July, FLA took the step of slashing salaries for staff members by 20 percent for the rest of the year and requiring non",Dave Jamieson,2013-08-03
"Olive Garden, Red Lobster Officials: We Stopped Serving Salad Mix Linked To Stomach Bug A Month Ago","The cyclospora infections account for more than 400 cases of illness in 16 states, according to the Centers for Disease Control","Reuters, Reuters",2013-08-03
California Prison's 'Pay-To-Stay' Option Offers 'Quieter' Rooms For $155 A Day,"The program has been criticized by the American Civil Liberties Union as a ""jail for the rich,"" KQED news reports. However",Caroline Fairchild,2013-07-28
"Kennedy, Kidd and the Keys to Success","Connections can get your foot into the door for an interview or, in the examples above, help you land the job, but, soon performance counts.","Howard Steven Friedman, Contributor
Statistician and health economist for the United Nations; Teac...",2013-07-28
Federal Reserve's Jeffrey Lacker: Exit From Bond-Buying Program Should Be 'Quick',Fed Chairman Ben Bernanke jolted markets in late May with plans to ease back on stimulus efforts once the economy improves,"Reuters, Reuters",2013-07-27
6 Ways A $12 Minimum Wage Would Help The Economy,A report from non-partisan public policy center Demos released in 2012 looked into the effect of large retailers raising,Caroline Fairchild,2013-07-21
The Largest Municipal Bankruptcies in U.S. History: 24/7 Wall St.,"On Thursday, the city of Detroit filed for Chapter 9 bankruptcy protection. The total value of the city’s outstanding obligations",,2013-07-21
Companies With 'Cash On The Sidelines' Should Pay Workers More,"American companies have been piling up more and more cash lately, which perversely has become a talking point for why the","Slate, Slate",2013-07-21
What Actually Happens At The End Of Trading Places?,"It's been 30 years since Trading Places came out. And, to be honest, I never really understood what happened at the end of",,2013-07-20
Costa Concordia Disaster: 5 Former Employees Sentenced To Jail,None of the five are likely to be jailed as the sentences of under two years were suspended and the longer ones may be replaced,"Reuters, Reuters",2013-07-20
SEC Takes Former Goldman Sachs Trader 'Fabulous Fab' To Trial In Civil Fraud Case,It is the highest-profile trial to date stemming from the SEC's investigation of the events leading up to the 2008 crisis,"Reuters, Reuters",2013-07-14
Inside The Company Making Sure Your Pot Is Strong (And Safe),"Dr. Robert Martin, the co-founder of medical cannabis testing company CW Analytical, is a 30-year veteran of the food industry",,2013-07-14
Lawyers Appreciated Even Less Than Business Executives: Survey,"The meager show of support for business executives is actually a slight improvement from previous polls. In 2009, when Pew",Caroline Fairchild,2013-07-14
"Eliot Spitzer's 'Sheriff Of Wall Street' Promise Will Be Tough To Keep, If Elected","More frequently, comptrollers use their power to clash with other city politicians and build their resumes. Top priorities","Reuters, Reuters",2013-07-13
The Most Corrupt Countries In The World: 24/7 Wall St.,More than half of the world’s population believes corruption in the public sector is a very serious problem. Liberia and,,2013-07-13
Annual Elections for Corporate Boards: For or Against?,Annual board elections are a progressive approach and best practice to board governance.,"Alice Korngold, Contributor
Author, ""A Better World, Inc.: How Companies Profit by Solving...",2013-07-07
Unhappy Spending: Why So Many People Are Broke,"Why do people who have money blow through it? The must-read new book, Happy Money: The Science of Smarter Spending gives some clues.","Don McNay, Contributor
Best selling lottery and structured settlement expert",2013-07-07
IMF Chief Christine Lagarde Calls U.S. Budget Cuts 'Inappropriate',"While the budget cuts that took hold on March 1 do not appear to be hitting government payrolls directly so far, some economists","Reuters, Reuters",2013-07-07
"Bill Dudley, 'Old McDonald,' Is Perhaps McDonald's Oldest Worker At Age 88","At age 88, Bill Dudley of North Wales in the UK is perhaps McDonald's oldest employee in the world -- and he intends to keep",Ron Dicker,2013-07-06
June Jobs Report: Upside Surprise,"This report, with its positive revisions, a whiff of increased labor force participation, and a bit of pop in wages suggests not just an improving job market, but one that's improving a bit faster than we thought.","Jared Bernstein, Contributor
Fmr. Obama administration economist; CNBC and MSNBC contributor",2013-07-06
"Nestle, Danone Both Possibly Price-Fixed Infant Formula Milk In China",Some Chinese infant formula companies have started forming partnerships with foreign firms to try to boost brand recognition,"Reuters, Reuters",2013-07-05
The Countries Spending The Most On Health Care,"Historically, health care spending among developed nations has grown considerably each year. However, beginning in 2010, spending",,2013-07-05
KFC Threatens Legal Action Against 'Hitler' Chicken Restaurant (PHOTO),"Hitler, which recently opened in Bangkok, Thailand, first garnered attention after Andrew Spooner, author of the ""Footprint",Ron Dicker,2013-07-05
Paul Krugman: Here's 1 Thing That Hasn't Changed Since 1776,"It's that time of year -- the long weekend when we gather with friends and family to celebrate hot dogs, potato salad and",,2013-07-05
"June Jobs Report: U.S. Economy Adds 195,000 Jobs; Unemployment Rate Unchanged",You can read the entire BLS analysis here. It's actually been growing quite quickly over the last half year: And the job,,2013-07-05
Four Life Insurance Policies Designed to Waste Your Money,Life insurance is your most important financial building block. But think about which life insurance works best for you. There are many insurance products like the four presented that may seem to make sense.,"Neal Frankle, Contributor
Financial planner",2013-07-04
Coffee Shop Closes Early On July 4th 'To Lament Britain's Loss' (PHOTO),"Editor's Note: The writer's dad is British, so just keep that in mind. So we salute you, clever coffee shop employee -- who",,2013-07-04
Minneapolis Is The Lowest-Unemployment Big City In America,The Bureau of Labor statistics is out with its latest metropolitan area unemployment figures and I'm proud to announce that,"Slate, Slate",2013-07-04
Let's Run Government Like a Business -- Or Not,"Americans routinely decry the inefficiency of government.  Why, they ask, can't it be run more like a private sector company? To road-test this idea, let's think about one of the best run, most admired private sector companies in America: Google.","Terry Newell, Contributor
President, Leadership for a Responsible Society",2013-06-30
Life Lessons From the Fake Dry Cleaners,"I worked at a dry cleaning business that had no dry cleaning equipment. Since I was the only employee, there was not a lot to manage. However, the experience at the dry cleaners was a better lesson in business than studying for an MBA.","Don McNay, Contributor
Best selling lottery and structured settlement expert",2013-06-30
"For Top Executives, An Unstoppable Climb In Pay","WHEN we made our annual foray into the executive pay gold mine in April, chief executives' earnings for 2012 showed what",,2013-06-30
The Most Competitive Cities Of The Future: 24/7 Wall St.,"Singapore is currently the most competitive city in the world, beating out New York and London, according to the Economist",,2013-06-30
Nitrogen Leak At Arizona Intel Plant Sends Employees To Hospital,"""There is no ongoing danger,"" Mulloy said. The plant in Chandler employs about 11,000 people. Intel operates two high-volume",Melissa Jeltsen,2013-06-29
IRS Sent $46 Million In Refunds To 'Unauthorized' Workers At One Atlanta Address,"This is not the first time the IG has chided the IRS for ineffective management. Earlier this year, the IG determined that",Sara Gates,2013-06-23
When Banks Compete You Win -- Except When You Lose,"Consumers shopping for a mortgage who want assurance that all quoted prices are valid should seek multi-lender web sites that post prices received directly from lenders, not prices submitted by intermediaries.","Jack Guttentag, Contributor
Professor of Finance Emeritus at the Wharton School of the Uni...",2013-06-23
The Oldest Company Logos In America: 24/7 Wall St.,"Prudential Logo, Then and Now Based on a review of Fortune 500 companies, 24/7 Wall St. identified the 10 oldest corporate","24/7 Wall St., 24/7 Wall St.",2013-06-22
