headline,short_description,authors,date
Lessons From My Father: Thinking Like an Entrepreneur in Everyday Life,"My father would always push me to ask for things -- even, and especially, when I was completely embarrassed and afraid to. As a kid, I cringed whenever he did this -- I hated it. But as an adult, I'm thankful he showed me value of getting out of my comfort zone.","Tarun Wadhwa, Contributor
Entrepreneur and writer. Author of 'Identified.'",2013-06-16
Just Thinking About Money Leads To Corruption: Study,"""Considering the signiﬁcant role of money in business organizations and everyday life, the idea that subtle reminders of",Caroline Fairchild,2013-06-16
Mortgage Rates Extend Rising Streak to 6 Weeks,"It's starting to look like more than just a temporary blip. On June 13, mortgage finance company Freddie Mac announced that mortgage rates rose for the sixth consecutive week -- and the impact on mortgage activity is already starting to be felt.","Richard Barrington, Contributor
CFA, MoneyRates.com",2013-06-15
Gordon Ramsay Sued Over Unpaid Wages By Employees At His Fat Cow Restaurant,"Radar online is reporting that the celebrity chef known for hosting FOX reality TV shows ""Kitchen Nightmares"" and ""Hell’s",Harry Bradford,2013-06-15
I Promise Not to Be Cheery If You Promise to Stop Stereotyping,"If you're a woman in the workplace, you need to stop smiling. Why? Because according to a just-released study, ""women [leaders] who looked cheerful were judged to be less willing to lead"" than men who displayed similar emotions.","Alison A. Quirk, Contributor
Executive Vice President, State Street Corporation",2013-06-09
"I'm Fired? Why, Thank You!","It started out like any other day. Isn't that the way every ""I got fired"" story begins? Well, add me to the list.","Maureen Anderson, Contributor
Maureen Anderson is the host of the nationally syndicated radi...",2013-06-09
Power and Influence,"Power and leadership are being redefined. No longer are we comfortable equating leadership with force, and power with dominance. In forward-thinking corporations, power is shifting from I-centric to We-centric, and this shift requires a commitment and a plan of action.","Judith E. Glaser, Contributor
CEO, Benchmark Communications, Inc.; chairman, The Creating WE...",2013-06-09
"Booz Allen Hamilton: Edward Snowden News 'Shocking', 'A Grave Violation'",Snowden's whistleblowing helped reveal that the NSA had been collecting millions of phone records daily and tapping into,Alana Horowitz Satlin,2013-06-09
Arianna Discussed Youth Unemployment With Fareed Zakaria On CNN's 'Your Money' (VIDEO),Arianna appeared on CNN's 'Your Money' to discuss youth unemployment and the student debt crisis. Fareed Zakaria also joined,"Huff TV, Contributor
Contributor",2013-06-08
Ikea's New Free Food Deal -- and the Powerful Psychology Behind It,In the end what's so fascinating is that customers may be completely aware of how Ikea's deal will manipulate them. But they may be fine with it anyway.,"Troy Campbell, Contributor
Contributor",2013-06-02
Paul Krugman: Debunked Reinhart-Rogoff Paper 'Did A Lot Of Damage' (VIDEO),The Nobel Prize-winning economist and New York Times columnist told Fareed Zakaria that “the stakes are high” in his public,Jillian Berman,2013-06-02
"Austrian Bank Employee Fired After Accidentally Dropping Nearly $117,000 In Cash Into River: Report","An employee of a bank in Austria was fired after dropping 90,000 euros (nearly $117,000) in cash off a bridge into a river",Hunter Stuart,2013-06-02
7 Major Immigration Myths Debunked: Forbes,"Myth 5: Low-skilled workers take away jobs, lower salaries and hurt the economy. As producers and consumers, illegal immigrants",Caroline Fairchild,2013-06-01
Coolest Jobs Of 2013: CNBC,More from CNBC --The 'Wild West' of Online Poker Goes Legit in US --Who Pays for Catastrophes? --Texas Counties Set Example,"CNBC, CNBC",2013-06-01
"Kettle Resembles Hitler On J.C. Penney Billboard, Passersby Say (PHOTO)","Update, May 28: J.C. Penney responded to our question on Twitter. Drivers on Interstate 405 near Culver City, Calif., may",,2013-05-27
Krugman: An Obamacare Shock Is Coming,"The Affordable Care Act, a k a Obamacare, goes fully into effect at the beginning of next year, and predictions of disaster",,2013-05-27
"Etienne Syldor, Orlando Man, Faces Foreclosure Despite Claims He Paid His Loan In Excess, And Early","Explained Wells Fargo representative Veronica Clemons, in a statement to WFTV: Reached for comment by The Huffington Post",Ryan Grenoble,2013-05-26
Banks' Lobbyists Help In Drafting Financial Bills,WASHINGTON -- Bank lobbyists are not leaving it to lawmakers to draft legislation that softens financial regulations. Instead,,2013-05-26
Paul Krugman: Conservative Movement Allows 'No Room For Independent Thinking',"“There remains essentially no room for independent thinking within the conservative movement,” Krugman wrote. “Being a good",,2013-05-25
States With The Most Americans On Disability: 24/7 Wall St.,The number of Americans receiving Social Security Disability Insurance (SSDI) more-than doubled over the past two decades,,2013-05-25
Why Nobody Cares That The Deficit Is Shrinking,"On May 14, as Washington officialdom was transfixed by the IRS scandal, the Congressional Budget Office announced that the",,2013-05-25
10 Countries Where People Fear For Their Safety: 24/7 Wall St.,"Some of the nations where residents do not feel safe are among the world’s poorest, including Afghanistan and Madagascar","24/7 Wall St., 24/7 Wall St.",2013-05-19
6 Career-Killing Phrases You Should Stop Using Immediately,Whether making an important presentation to potential clients or trying to motivate a room full of entry-level employees,,2013-05-19
"Winning Powerball Numbers May 18: 22, 10, 13, 14, 52 And 11","The previous Powerball jackpot record was set in November 2012, when two winning tickets split a prize of $587.5 million",Andres Jauregui,2013-05-19
Ben Bernanke Optimistic About Future Innovation In Commencement Address,"""Nobody really knows; as Berra also astutely observed, it's tough to make predictions, especially about the future. But there","Reuters, Reuters",2013-05-18
Jobseekers: Understanding the Candidate Experience,There has been a significant amount talk about the candidate experience for the last several years among those responsible for hiring or those who are part of the hiring process. It is an ongoing discussion that never seems to yield a very good answer but always stirs up a bit of a response and then fades quickly to black.,"Rayanne Thorn, Contributor
VP of Marketing",2013-05-18
Preparing to Live in That Unknown Country: The Future,"Are Google's driverless car and Siri just the beginning for applied machine intelligence/Big Data? Automated trucks, for example, could eliminate millions of jobs. Will this type of automation be good or bad -- economically and socially? How will it transform society?","Steven Strauss , Contributor
John L. Weinberg/Goldman Sachs & Co. Visiting Professor at Pri...",2013-05-12
Half Of College Grads Work Jobs That Don't Require A Degree: Study,A separate study by the Center for College Affordability and Productivity from earlier this year also found that around half,Harry Bradford,2013-05-12
"Bloomberg Terminal Spying Targeted Ben Bernanke, Tim Geithner: CNBC","Bloomberg CEO Daniel Doctoroff admitted that it was a ""mistake"" to give journalists access to client data. The company announced",Alana Horowitz Satlin,2013-05-11
DOJ Launches Probe Against U.S. Barclays And Ties To Saudi Prince,A prominent member of the Saudi royal family is at the heart of a US criminal probe into whether Barclays made improper payments,,2013-05-11
Bloomberg CEO: Client Data Access For Reporters Was A Mistake,May 11 (Reuters) - After reports that users of the company's financial terminals were investigating potential leaks of confidential,"Reuters, Reuters",2013-05-11
American Apparel CEO Dov Charney On Bangladesh: Start Making Clothing In A Human Way,"Advertising watchdogs also have criticized American Apparel for its overtly sexual marketing tactics, and Charney has faced",Kim Bhasin,2013-05-11
6 Ways To Tell Lies From Statistics,"4. Don’t fall into the trap of thinking about an empirical finding as “right” or “wrong.” At best, data provide an imperfect","Bloomberg View, Bloomberg View",2013-05-05
10 Cities With The Worst Traffic: 24/7 Wall St.,"INRIX, a traffic information and services group, collects data for individual road segments. In its 2012 Traffic Scorecard","24/7 Wall St., 24/7 Wall St.",2013-05-05
"America's Youth Nonemployment Rate Is One Of The Worst Of Wealthy, Large Economies: Report","Of those young people that are employed, many are working in jobs they’re overqualified for. More than 40 percent of those",Jillian Berman,2013-05-05
Bangladesh Agrees To Plan To Improve Worker Conditions After Factory Collapse,"Bangladesh’s government, employers and workers have agreed to a plan with the International Labour Organization that would",,2013-05-05
Larry Summers: Reinhart-Rogoff Debacle Shows No Policy Should Be Based 'On A Single Statistical Result',The extrapolation from past experience to future outlook is always deeply problematic and needs to be done with great care,"Reuters, Reuters",2013-05-05
Flammable or Inflammable,"""Inactive"" means not active; """"incapable"" means not capable; ""inseparable"" means not separable; and on and on the examples go.  It doesn't make sense that ""inflammable"" means flammable. But we need to keep in mind that it's not always easy to translate one language accurately into another.","William B. Bradshaw, Contributor
Author",2013-05-04
"Niall Ferguson: Keynesian Economics Flawed Because Keynes Was Gay, Childless","In 2012, Ferguson was roundly criticized for an article he wrote for Newsweek on President Barack Obama's administration",Meredith Bennett-Smith,2013-05-04
America's Most Profitable Products: 24/7 Wall St.,Successful companies frequently rely heavily on just one product for the majority of their sales and profit. That’s true,,2013-05-04
"Austerity Having A 'Devastating Effect' On Health, Researchers Find","""The harms we have found include HIV and malaria outbreaks, shortages of essential medicines, lost healthcare access, and","Reuters, Reuters",2013-04-28
Financial Literacy Is the Best Gift,"We are wary of used cars salesmen, but how conscious are we of the fact that almost everything we buy is sold to us by a commission-based broker who wins when they convince us to buy more than we came to purchase?","Natalie Pace, Contributor
Co-creator of Earth Gratitude & author of The Gratitude Game, ...",2013-04-28
Here's How To Tax Marijuana,It's been nearly six months since voters in Colorado and Washington legalized marijuana for recreational use. Read more on,,2013-04-28
This FAA Sequester Vote Doesn't Smell Right,Is this bipartisan support to mitigate one of the noxious effects of sequestration? Or is it papering over the high-visibility stuff that affects the affluent while lots of other budget bleeding goes on beneath the radar?,"Jared Bernstein, Contributor
Fmr. Obama administration economist; CNBC and MSNBC contributor",2013-04-27
"At Least 2 Bangladesh Factory Owners, 4 Others Arrested After Building Collapse (UPDATED)","Rana is accused of ignoring warnings that the complex was unsafe, and of adding extra floors to the building without the",,2013-04-27
American Cities With The Worst Health Coverage: 24/7 Wall St.,"These are the cities with the worst health coverage, according to 24/7 Wall St.: Jobs in areas like management, business","24/7 Wall St., 24/7 Wall St.",2013-04-21
Koch Brothers Set Their Sights On Controlling The Media,"Three years ago, Charles and David Koch, the billionaire industrialists and supporters of libertarian causes, held a seminar",,2013-04-21
EBay Aims To Recruit More Than 40 Million Users To Help Fight Online Sales Tax Law,The legislation includes an exemption for merchants that generate less than $1 million in annual out-of-state revenue. If,"Reuters, Reuters",2013-04-21
The 19 Most Stoner Product Ideas Of All Time (PHOTOS),"Every so often, there comes along a product so revolutionary, so original, so genius, that you're forced to consider if the",Harry Bradford,2013-04-20
"How The 'World's Worst Bank', Royal Bank Of Scotland, Is Trying To Save Itself",Rory Cullinan runs the world’s worst bank from a fifth-floor office overlooking Liverpool Street station in London. His 400,,2013-04-20
Texas Plant Explosion Reveals Wide Gaps In Workplace Safety Laws,"Investigators have descended on West, Texas, to assess the company's role in the disaster, which raises another common gripe",Dave Jamieson,2013-04-20
"Ben Bernanke To Skip Jackson Hole, Marking The First Time A Chairman Has Missed The Summit In 25 Years",This year's meeting would have been viewed as an excellent opportunity for Bernanke to signal that the central bank might,"Reuters, Reuters",2013-04-20
Cities Where Americans Don't Feel Safe: 24/7 Wall St.,"According to polling service Gallup, 72% of Americans surveyed in 2012 said they felt safe walking home at night. This is",,2013-04-14
China's Middle Class Sparks High Demand For U.S. Fur,"""We had over 700 registered buyers and the majority were from China,"" said Nancy Daigneault, communications director for","Reuters, Reuters",2013-04-14
Are Billionaires Just Smarter Than Everyone Else?: CNBC,"There is one caveat to the theory. The study measures cognitive ability by attendance at 29 selected ""elite colleges,"" which","CNBC, CNBC",2013-04-13
Jamie Dimon Facing Increased Pressure Over Chairman Role After Weak First-Quarter Results,"Worse still for Dimon, the bank's relationship with regulators has deteriorated in recent years, and JPMorgan's board blames","Reuters, Reuters",2013-04-13
Most Employers Won't Drop Health Care Coverage Because Of Obamacare: Survey,"Still, those businesses seem to be outliers. Nearly 90 percent of employers don’t plan to shift full-time workers to part",,2013-04-13
U.S. Gas Prices Fell Over The Past Two Weeks: Survey,"Of the cities included in the survey, Billings, Montana, had the lowest gas price at $3.33 a gallon, while drivers in Chicago","Reuters, Reuters",2013-04-07
"CEO Pay May Be Down, But Private Jet Use Is Up","RELAX. Sit back. And forget, for a moment, those pesky shareholders and bothersome boards, the regulations, the investigations",,2013-04-07
"Paul Krugman, David Stockman Spar Over Federal Reserve Policy (VIDEO)","Krugman criticized the op-ed, calling Stockman a “cranky old man,” and referring to the piece as “just a series of gee-whiz",,2013-04-07
"Hey, They Are Stretching the Truth Way Too Far",I was struck by what came out of the Troika this week after it finished negotiating the program with the authorities in Cyprus. This is not the first time officials bungle an element of the Cypriot rescue.,"Mohamed A. El-Erian, Contributor
Chief Economic Advisor, Allianz",2013-04-07
IRS Refund 2013: Here's What You Need To Know,"Remember: Tax Day 2013 -- the deadline to file your 2012 taxes -- is Monday April 15, 2013. Failure to file your taxes on",Harry Bradford,2013-04-06
The Different Types of Conference Speakers,"There are pros and cons to using all types of speakers. Understanding them helps conference organizers make necessary tradeoffs, striking the balance between cost and quality.","Phil Simon, Contributor
Author, keynote speaker, professor",2013-04-06
"284,000 College Graduates Had Minimum-Wage Jobs Last Year","About 284,000 Americans with college degrees were working minimum wage jobs last year, according to the Wall Street Journal",,2013-03-31
The Other Hazard of Hydraulic Fracturing -- Silica in the Air,"This week, NPR broadcast an interesting report about a researcher who has been studying health effects on workers on frac crews. Not familiar with hydraulic fracturing, he expected to find the workers exposed to toxics in drilling fluids when he want on location. What he found was very different.","Robert L. Cavnar, Contributor
Energy Veteran and Author, Founder, this-small-planet.com",2013-03-31
America's Most Miserable Cities: 24/7 Wall St.,"According to a recent study, the city with the most content residents in the United States is Lincoln, Neb. The city with",,2013-03-31
Murky Waters in Allentown,"Open government and transparency are essential pillars of a functioning democracy. But when governments privatize public services and infrastructure, we too often lose access to information and the tools to hold officials accountable.","Wenonah Hauter and Donald Cohen, Contributors",2013-03-30
"Cyprus President Nicos Anastasiades Threatened To Resign, Source Says",* Cyprus nearing Monday deadline to seal EU bailout PARLIAMENT It was far from certain that a majority of lawmakers would,"Reuters, Reuters",2013-03-24
"Cyprus Limits ATM Withdrawals At Biggest Banks, As Panicked Savers Race To Drain Accounts","NICOSIA, March 24 (Reuters) - The central bank in Cyprus imposed a 100-euros per day withdrawal limit at cash machines for","Reuters, Reuters",2013-03-24
The Rise And Fall Of The Stapler,"DO you have a stapler? If you do, maybe it’s a little dusty in this age of PDFs. Read more on The New York Times",,2013-03-24
Half Of Americans Want To Break Up Banks That Are Too Big To Fail: Poll,"According to a new poll by Rasmussen Reports, 50 percent of Americans want the government to break up the country's big banks",Bonnie Kavoussi,2013-03-23
Wall Street May See Opportunity In Marijuana,"BELVIDERE, N.J. — Amid the whir of fans and the glow of soft white light, workers tended to bright green seedlings sprouting",,2013-03-23
Universal Entertainment Corp. Blames Ex-Employees For Making Alleged Bribes Amid FBI Probe,A PAGCOR lawyer assigned to the case helped broker an agreement in November 2009 under which Asiaworld gave Eagle I Landholdings,"Reuters, Reuters",2013-03-17
Cyprus Bank Levy Shakes Europeans' Faith In Savings,"""We must all together raise a shield to protect the peoples (of Europe) from Ms Merkel's criminal strategy,"" said Tsipras","Reuters, Reuters",2013-03-17
Buffalo Wild Wings' Secret To Success: Pouring A Lot Of Beer,"In order to best manage the flow of beer in and out of its restaurants, the company has instituted a three-layered system","CNBC, CNBC",2013-03-17
The States That Drink The Most Beer: 24/7 Wall St.,"Total consumption of beer in the U.S. has fallen for the third straight year, according to a report published by the Beer",,2013-03-17
Richard Fisher Says Too-Big-To-Fail Banks Need To Be Broken Up,"""These institutions operate under a privileged status that exacts an unfair tax upon the American people,"" he said on the","Reuters, Reuters",2013-03-16
NYSE Readying Plan To Run Without Humans In Case Of Disaster: Report,"NYSE Euronext is preparing to submit details of the plan to the U.S. Securities and Exchange Commission, according to the","Reuters, Reuters",2013-03-10
Paul Krugman: Sheryl Sandberg's Book Shows How 'Unprepared We Are To Have Women As A Full Part Of Our Society',"Krugman defended the book on “This Week with George Stephanopoulos"" Sunday. In addition, women face unconscious stereotypes",,2013-03-10
How Horsemeat Is Dividing Europe,"OLOMOUC, Czech Republic — For Zuzana Navelkova, it was just another day at the office. She showed up for work last month",,2013-03-10
Retirement Planning: The 'Magic Numbers' Are Different For Everyone,Everyone has a different opinion on exactly how much you should save for a stress-free retirement. Even the experts argue,,2013-03-09
Telework's Snow Ball Fight,"With Telework Week 2013 ending on a high note, we now look at what we learned from the initiative and how we can improve even more.","Cindy Auten, Contributor
General Manager, Mobile Work Exchange",2013-03-09
Wells Fargo Typo Victim Dies In Court,"On the morning of Dec. 19, 2012, in a Torrance courtroom, Larry Delassus' heart stopped as he watched his attorney argue",,2013-03-09
Anheuser-Busch Takes Out Full-Page Ads To Fight Claims It's Watering Down Beer,Beer consumers have filed a proposed class-action lawsuit accusing the company of mislabeling the alcohol content of the,"Reuters, Reuters",2013-03-03
Paul Krugman: Republicans 'Just Won't Take Yes For An Answer',"“In a year — or more likely in a minute or two — Republicans would be back, demanding more tax cuts and more cuts in social",,2013-03-03
Amazon Removes 'Keep Calm And Rape' T-Shirts; Seller Solid Gold Bomb Apologizes (VIDEO),Although we did not in any way deliberately create the offensive t-shirts in question and it was the result of a scripted,,2013-03-02
Ben Bernanke: Raising Interest Rates Carries 'Risk Of Short-Circuiting The Recovery',"He noted that a stimulative monetary policy was simply a response to economic conditions, rather than any attempt to keep","Reuters, Reuters",2013-03-02
Why Marissa Mayer Makes Me Mad as a Mom and a Manager,"Mayer's decision, ironically, is a huge diss on her own product set. It's like she's saying what Yahoo! offers doesn't deliver when it comes to creating meaningful human exchanges. For that we apparently need to resort to offices cubicles and water cooler encounters.","Ann Francke, Contributor
Management Expert and CEO of the Chartered Management Institute",2013-03-02
"Red Sox Pitcher Curt Schilling's Bloody Sock Sells For $92,612.50 At Auction","""I'm auctioning these pieces off because I want to take care of my family, my charity, and to turn them over to history,"" Eruzione","Reuters, Reuters",2013-02-24
Wall Street Bonuses For Top Employees Dropped 38 Percent Last Year: Survey,"Bonuses for “front-office” financial professionals -- or bankers and traders -- declined 38 percent in 2012 from 2011, according",,2013-02-24
Six States (And D.C.) With The Highest Gas Prices,"Gasoline prices have risen more than 13% during the past month, and the chance that the average price per gallon nationwide",,2013-02-24
U.S. Gas Prices Soar With Drivers Paying 20 Cents More Per Gallon,"The lowest average price for a gallon of unleaded gas in the 48 contiguous U.S. states was $3.23 in Billings, Montana, and","Reuters, Reuters",2013-02-24
Major Banks Aid In Payday Loans Banned By States - NYTimes.com,Major banks have quickly become behind-the-scenes allies of Internet-based payday lenders that offer short-term loans with,,2013-02-24
The 13 Most Outrageous Job Interview Mistakes: Forbes,"“In this job market, it can be tough just to get a face-to-face interview,” she says. “When the day comes, it’s not uncommon","Forbes, Forbes",2013-02-23
Life Lessons From a Street Wise Guy,"My street wise father, Joe McNay, taught me that servers, nurses, plumbers and other support  people can be the most important individuals in your life. Dad died 20 years ago this week at age 59.","Don McNay, Contributor
Best selling lottery and structured settlement expert",2013-02-23
"Gerard Depardieu, Actor, Receives Russian Residency Stamp In Quest To Avoid High French Taxes","Located on the river Volga some 620 km (390 miles) east of Moscow, Saransk is the capital of Mordovia, a republic in central","Reuters, Reuters",2013-02-23
Poland Spring Water Bottles May Be Contaminated By Gasoline,"Citing information provided by state health officials, Patch.com reports that ""exposure levels are unlikely to result in",Dominique Mosbergen,2013-02-23
Potential Nominee For Head Of Office Of Management And Budget Could Be Coup For Walmart,"Recent reports suggest that President Obama is about to nominate Sylvia Mathews Burwell, the president of the Walmart Foundation",,2013-02-18
Minimum-Wage Haters: 11 People Who Have Spoken Out Against The Law,"Many have praised President Obama's call to increase the federal minimum wage, saying it would help working-class families",Jillian Berman,2013-02-18
"The Keystone XL Pipeline, Terrorism and Our National Security","Are we helping to fund a future danger on our northern border, and will the revenues generated by the Keystone Pipeline help to create a condition deeply adversarial to our national security?","Raymond J. Learsy, Contributor
Author",2013-02-18
All Around Pizza Offers 15 Percent Discount To Gun Owners In Virginia Beach (VIDEO),"Got a gun? If so, All Around Pizza and Deli will take 15 percent off your order, local news outlet WTKR NewsChannel 3 reported",Sara Gates,2013-02-17
JFK Items Hit Auction Block 50 Years After His Assassination,"Powers was close to the president throughout his political career, from 1946 until his assassination in 1963. He remained","Reuters, Reuters",2013-02-17
Raise the Minimum Wage or Cut Low-Wage Taxes?,"President Obama just called for an increase in the federal minimum wage from $7.25 to $9.00 an hour. Yet he made no effort to save the ""temporary stimulus"" 2% payroll tax cut. So what's better for low-wage workers: an increase in the minimum wage or a decrease in payroll taxes?","Mary (Polly) Cleveland, Contributor
Economist",2013-02-17
Panera Bakers Battle For A Union In A Union-Free World,"But according to Dan Wood, the baker who's taken the lead for the unionizing effort in Michigan, Saber's company has imposed",Dave Jamieson,2013-02-16
"Brendan Kennedy, CEO Of Privateer Holdings, To Invest In Marijuana Industry","BRENDAN KENNEDY received an engineering degree, started a software firm and sold its assets to Boeing, studied for a Yale",,2013-02-16
9 Jobs That Earn Less Than Minimum Wage,"In his State of the Union address, President Obama called on lawmakers to increase the federal minimum wage from $7.25 to",Caroline Fairchild,2013-02-16
Maker's Mark Reducing Alcohol Content To Keep Up With Demand,"Maker’s Mark just got a little less stiff. The bourbon brand, known for its bottles sealed with red wax, told customers today",,2013-02-10
