headline,short_description,authors,date
The Nine U.S. Cities Selling The Most To China: 24/7 Wall St.,"Last year, U.S. exports to China topped $100 billion for the first time. The country is now the third-largest importer of",,2012-09-30
The Real Returns of Mobile ROI,"Mobility, especially in the convergent world, offers us the closest peek into a host of transactional factors that we have never really seen before.","Sasha Grujicic, Contributor
EVP, Strategy, Digital and Insight, Aegis Media",2012-09-30
Faces Of Child Labor (PHOTOS),"Child labor has long been a part of economic life. In U.S. history, as the Industrial Revolution moved the workplace from",,2012-09-29
"U.S. Postal Service Doesn't Have To Reduce Service To Save Money, Regulator Says","The PRC opinion said that at most, that plan would save about $2 billion, slightly less than the Postal Service has projected","Reuters, Reuters",2012-09-29
Labor Force Dropouts: Why The Jobs Crisis Is Worse Than We Think,"""This is significant. People are making the decision to put those off because the assurance of a return to investment is","Reuters, Reuters",2012-09-23
America's Poorest States: 24/7 Wall St.,"From 24/7 Wall St: Median household income in the United States declined for the second straight year, according to data","24/7 Wall St., 24/7 Wall St.",2012-09-23
Thinking Fast and Slow and Poorly and Well,The world is full of strange behavior. It is natural to theorize this is due to irrational biases. But often apparently strange behavior is the right solution to a complex problem.,"David K. Levine, Contributor
John H. Biggs Distinguished Professor of Economics, Washington...",2012-09-22
Five States That Donate The Most To Presidential Campaigns: CNBC,The states that donate the most money to presidential campaigns are among the largest and most populous in the country. Places,"CNBC, CNBC",2012-09-22
Glenn Hubbard: 'Naive' To Think Fed Stimulus Can Solve Jobs Crisis,"“I would be much more comfortable if, in fact, Congress would take some of this burden from us and address those issues,"" Bernanke",Jillian Berman,2012-09-16
Debt Collectors Using Prosecutors' Letterhead To Recover Debts,"The letters are sent by the thousands to people across the country who have written bad checks, threatening them with jail",,2012-09-16
Are You Committed? Should You Be?,"What determines how much I have to do?  Peter Drucker, one of the finest business thinkers of the last century, said that as knowledge workers we define both our work and its results. This would imply that we somehow have control of what's to be done.","Todd Brown, Contributor
Director, Next Action Associates",2012-09-16
Occupy Wall Street Plans To Surround New York Stock Exchange To Mark Anniversary,"On Friday, Twitter was ordered by a New York judge to turn over the tweets of one of the protesters arrested on the bridge","Reuters, Reuters",2012-09-15
Bernanke's QE3 Challenge,Probably the most convincing evidence that Quantitative Easing works is the revival of housing sector. Economists agree that the collapse of housing values is a major deterrent to consumer spending. Housing could finally begin to recover this year.,"Harlan Green, Contributor
Editor/Publisher",2012-09-15
The Most Expensive NFL Tickets Of The Season: CNBC,"The season opener Wednesday night between the Super Bowl Champion New York Giants and the Dallas Cowboys made the list, but","CNBC, CNBC",2012-09-09
"Bernard Arnault, France's Richest Man, Seeks Belgian Passport As Country Weighs Tax Increases","A socialist president who took office in the midst of Europe's continuing economic crisis, France's Francoise Hollande faces",Meredith Bennett-Smith,2012-09-09
Greek Austerity Plan Questioned By Troika Officials,Thousands of Greeks demonstrated against the cuts at a prominent annual trade fair on Saturday in the northern city of Thessaloniki,"Reuters, Reuters",2012-09-09
The World's Worst Economies: 24/7 Wall St.,"For most of the 20th century, the United States has been considered the world's economic superpower. And up until four years",,2012-09-08
George Soros To Germany: Lead Europe From Crisis Or Get Out,"""LOST DECADE"" Berlin has given its backing to the European Central Bank's new bond-buying programme to lower struggling euro","Reuters, Reuters",2012-09-08
Obama Owes Us An Explanation,President Barack Obama owes us an explanation for why the economy has been working so much better for financial behemoths than it has for ordinary people.,"Peter S. Goodman, Contributor
Executive Business and Global News Editor, The Huffington Post",2012-09-03
Ex-BP CEO Gets His Life Back,"IF there's a public villain of the Gulf of Mexico oil spill -- one person who, rightly or not, will be remembered for the",,2012-09-03
The Omerta Surrounding Goldman Sachs: A Documentary,"If it is true we are sleepwalking into a depression worse than we have known before, we must wake up quickly.","Vivian Norris, Contributor
Dr. (Ph.D.)",2012-09-03
Who's Fighting for Workers?,"I know who's fighting for wealthy people, for the finance industry, for the oil companies. I can see who's fighting for the troops and even for the poor, though the latter are surely harder to find than the rest. But who's fighting for working people?","Jared Bernstein, Contributor
Fmr. Obama administration economist; CNBC and MSNBC contributor",2012-09-03
"David Mulford, Credit Suisse Executive, Faces Extradition For Role In 2001 Argentine Debt Swap","* Mulford was U.S. Treasury undersecretary, ambassador The Swiss bank declined to comment. Federal Judge Marcelo Martinez","Reuters, Reuters",2012-09-03
There Once Was a Union-Made,"I walked in and meandered around the shop, looking at the pricy shirts, pants, sweaters, jackets, shoes, and other articles of clothing. After examining the apparel, I couldn't find any items with a union label. What gives?","Peter Dreier, Contributor
E.P. Clapp Distinguished Professor of Politics, Occidental Col...",2012-09-02
Banks Face Threat Of Billions In U.S. Fines Over Iran Connections,A half-hearted shuffling forward to settle years-old claims of busting U.S. sanctions on Tehran is becoming a stampede since,"Reuters, Reuters",2012-09-02
America's Most Stressful Jobs,"And what kind of jobs cause the most stress? Law enforcement agents, taxi drivers and corporate executives are some of the",Harry Bradford,2012-09-01
Middle Class America: 5 Sad Charts About The Country's Favorite Demographic,"Things aren’t going very well for the middle class right now. If you don’t believe us, take a look at these charts. Over",,2012-09-01
Bundesbank Bank Chief Axel Weber: Bond Buying 'Like A Drug',"To avert this risk, German finance ministry officials were exploring an option where Spain or Italy would make a commitment","Reuters, Reuters",2012-08-26
One Man Against The Wall Street Lobby,There is a new powerful voice who knows how big banks really work and who is willing to tell the truth in great and convincing detail. Jeff Connaughton has just published a page-turning memoir that is also a damning critique of how Wall Street operates.,"Simon Johnson, Contributor
Author, 'White House Burning: The Founding Fathers, Our Nation...",2012-08-25
Different Types Of Medical Marijuana,"Positions on the efficacy of medical marijuana vary, but thousands of patients suffering from cancer, AIDS, and other diseases",,2012-08-25
"Defense Workers To Congress: Solve The Problem, Stop The Automatic Cuts","With two teenagers at home, Larkin is worrying about how he will pay for college tuition if the cuts come. He's recruiting","Reuters, Reuters",2012-08-19
Shane Smith & Eddy Moretti Talk Youth Unemployment On HuffPost Live (VIDEO),HuffPost Live president & co-creator Roy Sekoff was joined by VICE founder & CEO Shane Smith and Chief Creative Officer Eddy,,2012-08-18
Youth Unemployment: Is It The Bad Economy Or Inability To Overcome Adversity?,"I wonder if young people understand how to deal with adversity. If young people have been sheltered from overcoming failure, they may not understand that adversity ultimately leads to opportunity.","Don McNay, Contributor
Best selling lottery and structured settlement expert",2012-08-18
10 Cities Where Workers Have Big Cursing Problems: Report,But those who like to swear as much as our esteemed Treasury Secretary better be careful. The survey also found that most,Harry Bradford,2012-08-12
America's Most Affordable Housing Markets: 24/7 Wall St.,The housing crash that began in late 2006 resulted in trillions of dollars in lost wealth and millions of families owing,,2012-08-12
"It's Criminal, not Ethical",If we presume to be a society living under the 'rule of law' then we need our laws to be consistent and enforced uniformly. We need to strip corporate leaders of any 'shield' to their responsibility to follow both the letter and the intent of the law.,"Jim Selman, Contributor
Thought Leader in Field of Transformation and Leadership. Chai...",2012-08-12
"Olympic Excellence Only Occurs With Teamwork, Flexibility And Gut Instinct",The Olympic Games are unparalleled in their ability to break down barriers. Here are four ways that athletes follow an entrepreneurial path to achieve greatness.,"Naveen Jain, Contributor
An Entrepreneur, Dreamer & Lover of life. I am founder of Moon...",2012-08-11
States That Get The Most Federal Money: 24/7 Wall St.,"In 2010, the federal government took the hundreds of billions of dollars it received in corporate, income and property taxes",,2012-08-05
Nine Great American Companies That Will Never Recover: 24/7 Wall St.,"24/7 Wall St.: Many American companies have been lauded for their rapid rise to greatness, a process that sometimes takes","24/7 Wall St., 24/7 Wall St.",2012-08-04
Euro Crisis 2012: Greece Reportedly Saved From Bankruptcy By European Central Bank,Until now the Bank of Greece could only accept T-Bills up to a limit of 3 billion euros ($3.70 billion) as collateral for,"Reuters, Reuters",2012-08-04
What The Collapse Of Peregrine Financial Says About The Sarbanes-Oxley Law,"Nor has it brought increased competition to an industry that still is an oligopoly, now dominated by the so-called Big Four","Reuters, Reuters",2012-07-29
"CNOOC, Nexen Deal Faces Insider Trading Allegations From SEC",Well-timed bullish bets in Nexen options ahead of the announcement also raised eyebrows among some market watchers on the,"Reuters, Reuters",2012-07-28
"Aurora Shooting: Mall's Troubled History Of Racism, Crime","Freddie Hanns, 60, visits the mall almost every week and worked briefly as a contractor there during the renovations. Hanns",Alice Hines,2012-07-28
New Yorkers Struggle To Pay For Food As Jobs Crisis Continues,This past week had many New Yorkers indulging an amused horror over a curated set of images on the social-media site Tumblr,,2012-07-22
Super-Rich Hold Up To $32 Trillion In Offshore Havens: Report,The report also highlights the impact on the balance sheets of 139 developing countries of money held in tax havens by private,"Reuters, Reuters",2012-07-22
"Former Bank Of America, Cantor Fitzgerald Employees Sue Over Alleged Racial Discrimination","James claims he too was fired for raising the allegations and is asking to be rehired. He is also seeking back pay, bonuses","Reuters, Reuters",2012-07-21
China's Coming Great Deleveraging,"The root cause of the decline in China's economic growth this year is not the trouble in Europe or funk of the global economy, but rather the unsustainable economic bubbles that have been created by the government, and the collapsing demand that has accompanied it.","Dee Woo and Daniel Wagner, Contributors",2012-07-15
America's Sickest Housing Markets: 24/7 Wall St,"According to data released earlier this month, asking home prices in the nation's largest metro regions rose for the fourth",,2012-07-15
"National Futures Association, PFGBest Watchdog, Uses Auditors That Are 'Not Experienced Enough'","""Unfortunately if someone is prepared to go to the extraordinary lengths necessary to carry out a fraud, as it looks like","Reuters, Reuters",2012-07-14
"Telecommuters Less Likely To Get A Promotion, Study Finds",The report chalks up much of the discrepancy to managerial subjectivity. Managers are less likely to be comfortable with,James Sunshine,2012-07-14
Are Courthouses Obsolete?,"Are courtrooms obsolete? No, but many venues are located outside of the traditional courthouse or are increasingly subject to video conferencing such as arraignments.","Brad Reid, Contributor
Senior Scholar, Dean Institute for Corporate Governance and In...",2012-07-14
Contracting Oversight: A Long Way to Go,"The report, Final Forensic Audit Report of Iraq Reconstruction Funds, said the precise amount lost to fraud and waste can never be known, but believes it is significant.","David Isenberg, Contributor
Author, 'Shadow Force: Private Security Contractors in Iraq'",2012-07-14
Screw Business as Usual and the Rest of My Corporate Diplomacy Summer Reading List,"Summertime is always an excellent time to reflect, recharge and catch up on reading you've been meaning to read for longer","Cari E. Guittard, Contributor
Corporate Diplomat, Professor, Global Citizen",2012-07-14
U.S. Derivatives Regulations To Be Finalized,"WASHINGTON, July 8 (Reuters) - The U.S. swaps regulator is set to finalize this week a critical reform that will trigger","Reuters, Reuters",2012-07-08
Mom Skipped Out on the Lease and Collectors Are Chasing Me,"Sometimes the kids get hurt financially as a result. If your mother is not going to help you to repay the money which you appear to agree is due, then this will rest on your shoulders as a co-signer.","Steve Rhode, Contributor
Consumer Debt Expert & Firefighter",2012-07-08
10 Products Surprisingly Still Made In America: 24/7 Wall St.,"While some companies are considering returning jobs to the U.S., some brands never went away. 24/7 Wall St. compiled a list","24/7 Wall St., 24/7 Wall St.",2012-07-07
10 States Where Wages Are Falling,"Here are the ten states struggling with declining wages: Not every state's income fell, and states like North Dakota actually",James Sunshine,2012-07-04
Building Blocks to Increase Women's Economic & Political Progress,"Societies must recognize the importance of women, who comprise over half of the world's population, participating fully in policy decisions that are made at the local, national, and international levels.","Stephenie Foster, Contributor
Recovering diplomat, advocate, strategist. Working in the US &...",2012-07-04
Stockton Bankruptcy The Result Of 15-Year Spending Binge,"Before the turn of the millennium, things looked very different in California. * City manager: Retirees' healthcare ""a Ponzi","Reuters, Reuters",2012-07-04
States With The Most Underage Drinking: 24/7 Wall St.,"Earlier this week, the Centers for Disease Control and Prevention (CDC) released its 2011 Youth Risk Behavior Surveillance",,2012-07-01
Angela Merkel: Big Loser Of Eurozone Showdown,"* European media see Merkel beaten by France, Italy Spain ""The southern euro countries are taking the north hostage,"" wrote","Reuters, Reuters",2012-06-30
The 10 Tech Companies With The Highest Starting Salaries,Parents who punish their kids by taking away their computer privileges may be doing more harm than they know. That's because,James Sunshine,2012-06-24
Greece's Bailout Requests Likely To Face European Union Opposition,"The coalition brings together the conservative New Democracy, Socialist PASOK and Democratic Left in an alliance that will","Reuters, Reuters",2012-06-23
Michael Lawson's Straw Home Offers Roadmap For Ditching The Heating Bill,Take a look at the home in the video below: When James Orchard Halliwell-Phillipps wrote the fairy tale The Three Little,James Sunshine,2012-06-23
Creating a Family of Entrepreneurs,Some dads are great at tennis. Some dads are great at the piano. My dad is an incredible entrepreneur -- to say the least.,"Priyanka Jain, Contributor
Head of User Product, pymetrics",2012-06-17
The Least Peaceful Countries in the World,"In 2011, world peace improved for the first time in three years. Incidents of terrorism fell and the global economic downturn",,2012-06-17
"10 Jobs That Won't Be Taken By Robots, Yet",So what kinds of fields are a good bet for job seekers? Which industries should you aim for if you want to avoid being replaced,"The Fiscal Times, The Fiscal Times",2012-06-17
"Super-Rich Investing More In Treasure, Report Finds","“A desire for tangibility and familiarity, coupled with concerns about broader markets, is encouraging more investors to",,2012-06-16
Greece Elections: Euro Could Be Rocked By Vote,"Some global businesses and banks are already in retreat. ""That's why it's so important that the Greek elections preferably","Reuters, Reuters",2012-06-16
"Tim Bennett, John Nash Call For A Unified Gay Pride Holiday, New Marketing Strategy","The two are often asked to comment on what's right in gay advertising. For one, they said, an inclusive message like the",Ron Dicker,2012-06-16
The States With The Fastest Growing Economies: 24/7 Wall St.,"In 2011, the U.S. economy grew for the second straight year, although at a slower pace than in 2010. According to figures",,2012-06-10
Rajat Gupta Trial Testimony: Ex-Goldman Sachs Director Changes Mind About Testifying,"NEW YORK, June 10 (Reuters) - Former Goldman Sachs Group Inc board member Rajat Gupta, on trial on insider trading charges","Reuters, Reuters",2012-06-10
J.C. Penney's 'Frumpy' Customers Demand  Stores Remain Frumpy,There are a few upsides to J.C. Penney's small-town fleets. Those stores were the fastest to adapt to J.C. Penney's new pricing,Alice Hines,2012-06-09
Namasté Solar Allows Employees To Know How Much Their Coworkers Make,"""Usually, salary is an emotional and sticky situation,"" co-founder Blake Jones told American Express OPEN Forum. ""In the",Harry Bradford,2012-06-09
$33 Barrel Oil Now and Forever -- With Leadership!,Shale oil deposits are already being accessed through the oil industry's initiative in such locales as North Dakota with its rapidly growing oil production and its resulting and startling economic boom.,"Raymond J. Learsy, Contributor
Author",2012-06-03
Europe 'Fiscal Union' Proposal At Forefront Of Crisis Debate,That means for some time the European Central Bank will remain the institution capable of acting quickly to avert disaster,"Reuters, Reuters",2012-06-03
Minimum Wage For Restaurant Servers Remains Stagnant For 20 Years Under Industry Lobbying,"Similarly, a GOP-backed bill in Arizona would have lowered that state's tipped minimum wage of $4.65 by more than $2, among",Dave Jamieson,2012-06-02
Investors Brace for Global Slowdown,"The U.S. has lost an important part of its global leadership role. The G7 and IMF lack legitimacy and credibility. And the G20 is still working on its operational effectiveness. All this speaks to continued uncertainty and volatility -- economic, financial, political and social. Since the world starts naturally long risk assets, we could well see more investors seeking less risky asset allocations, including cash in what they deem as ""safe jurisdictions."" In the process, valuations -- for bonds, commodities, currencies, and equities -- could well diverge for a while from what many deem to be historically fair valuations. As Will Rogers is said to have observed decades ago, investors should be concerned with the return of their money and not just the return on their money.","Mohamed A. El-Erian, Contributor
Chief Economic Advisor, Allianz",2012-06-02
We Work Too Hard,"It would behoove us to remember that slow and steady often wins the race, just as a more balanced approach to work life can be more beneficial than the helter-skelter mindset of our cut-throat labor market.","David Vognar, Contributor
Social worker, writer, tinkerer",2012-05-28
"European Banks May Become More Vulnerable, As Bond Investors Threaten To Ditch Over New Rules",One of the ways in which banks are hoping to plug the likely funding gap is by issuing bonds secured on their prime mortgage,"Reuters, Reuters",2012-05-28
Paul Krugman: Big Fiscal Phonies,"Quick quiz: What’s a good five-letter description of Chris Christie, the Republican governor of New Jersey, that ends in",,2012-05-28
"What Is the Cultural Significance of Facebook's May 18, 2012 IPO?",I am less interested in the business model than the value our culture is putting on what is still perhaps the most important news gathering institution in the world -- versus the value it is placing on a social media company.,"Daniel R. Schwarz, Contributor
Daniel R. Schwarz is Frederic J. Whiton Professor of English L...",2012-05-28
Northern Rock Bank Run Offers A Lesson For Europe,Reassuring customers they will not lose money and strengthening the deposit guarantee scheme is nonetheless the biggest lesson,"Reuters, Reuters",2012-05-27
The Happiest Countries In The World,"For the second year in a row, 24/7 Wall St. examined the Organisation for Economic Co-operation and Development’s report",,2012-05-27
North And South America Poised To Become Important Players In The Oil Market,"LOMA LA LATA, Argentina — In a desertlike stretch of scrub grass and red buttes, oil companies are punching holes in the",,2012-05-26
"Replacements Limited, North Carolina Company, Sees Customer Blowback After Supporting Gay Marriage","In the months leading up to North Carolina’s vote this month to ban gay marriage, most of the state’s business leaders were",,2012-05-26
Wolfgang Schaeuble: 'It's Up To Greece To Abide By Its Obligations',"""The current situation is causing public uncertainty. That's exactly what political leaders shouldn't do."" Schaeuble said","Reuters, Reuters",2012-05-20
SEC Probing Chipotle Over Claims The Burrito Chain Hired Undocumented Workers,"Michael Wildes, an immigration attorney and a former federal prosecutor who is not involved in the case, said it is ""not","Reuters, Reuters",2012-05-19
Global Luxury Home Sales Fall For First Time Since 2009 On Europe Economic Woes,"Knight Frank said the fall in luxury house prices in the first three months of the year was led by Tel Aviv, where prices","Reuters, Reuters",2012-05-13
JP Morgan's Loss Could Be America's Gain,"The public opprobrium directed at Wall Street throughout 2008 and 2009 met with no satisfactory reformist result. That leaves us with Occupy Wall Street as the only viable option of steering the nation off the course of permanent high unemployment, low wages, and a shredded social safety net.","Joseph A. Palermo, Contributor
Author, historian, professor",2012-05-13
Jamie Dimon On Meet The Press: We Were 'Dead Wrong' To Dismiss Trading Concerns,"CEO Jamie Dimon said he did not know the extent of the problem when he said in April that the concerns were a ""tempest in",Maxwell Strachan,2012-05-13
Tax Rates Have Fallen The Most For The Richest Americans [GRAPHIC],"Since Bill Clinton's first term, taxes have fallen the most for the wealthiest Americans. Federal tax rates plunged 9.4 percent",Bonnie Kavoussi,2012-05-12
"San Diego Voters Want To Fine Banks $1,000 Per Day For Neglecting Foreclosed Homes","When banks don't do the upkeep on seized properties, the empty homes wind up being a huge financial drain on the community",Alexander Eichler,2012-05-12
Thoughts on the Big JP Loss,Financial markets are inherently unstable. They will neither self-correct nor self-regulate. Their instability poses a threat to markets and economies and people across the globe.,"Jared Bernstein, Contributor
Fmr. Obama administration economist; CNBC and MSNBC contributor",2012-05-12
College Grads Fight For Unpaid Internships With Full-Time Work Hard To Find,"Confronting the worst job market in decades, many college graduates who expected to land paid jobs are turning to unpaid",,2012-05-06
Blatant Insider Commodity Trading Given Pass That Would Put Stock Traders in Handcuffs,"Here we have this enormous dichotomy between insider trading in stocks and bonds, and commodities. The difference being, with commodity trading, most everyone is impacted.","Raymond J. Learsy, Contributor
Author",2012-05-06
European Elections Complicate Outlook,"Europe's election results sound an alarm for European integration and, consequently, the wellbeing of both the region and the global economy. Let us hope that the inevitable short-term volatility is a precursor to a more decisive effort to deal with the continent's festering problems.","Mohamed A. El-Erian, Contributor
Chief Economic Advisor, Allianz",2012-05-06
Renting Prosperity,Across the board—for goods ranging from cars to books to clothes—Americans are increasingly acclimating to the idea of giving,,2012-05-05
What Has Caused Record Inequality (and Greater Recessions)?,"We can no longer tolerate such a diversion of wealth that has weakened our economic and social fabric so much that we have fallen behind the rest of the developed world in education, health care, aging infrastructure, and even environmental protection.","Harlan Green, Contributor
Editor/Publisher",2012-04-29
Goldman's Asset Management Approached As Possible Candidate For Bank Of England Governor,"O'Neill, who coined the term 'BRIC' in 2001 to describe how the economic clout of Brazil, Russia, India and China would challenge","Reuters, Reuters",2012-04-29
International Labour Organization Report: 'Austerity Has Not Produced More Economic Growth',"* Warns of risk of social unrest in Africa, Middle East Labour market recovery has also stalled in Japan, the report said","Reuters, Reuters",2012-04-29
Maclaren USA Evades Court Investigation Of Its Puzzling Bankruptcy,"Maclaren USA, the closely held stroller company that quietly declared bankruptcy in December two years after it was forced",Alice Hines,2012-04-28
